category,book,book_id,author,publisher,edition,total_pages,pages_scraped,status,scraped_at,topics,url,file,*تنويه هام,book_index,cat_index,أعده للشاملة,البحث في,الرابط,الكتاب,المحقق,النص,بحث في محتوى الكتب,تنبيهات هامة,حققه وقدم له وعلق عليه,صفحة المؤلف,عام النشر,عدد الأجزاء,لدعم المشروع*,نبذة عن المشروع,نتائج البحث
التجويد والقراءات,إيضاح الوقف والابتداء,14255,محمد بن القاسم بن محمد بن بشار، أبو بكر الأنباري (ت ٣٢٨هـ),مطبوعات مجمع اللغة العربية بدمشق,,,990,complete,11-06-2026 19:19:43 IST,[+] | المقدمة | ذكر أسانيد ما في الكتاب من القراءات | باب ذكر ما لا يتم الوقف عليه | وكل ما في كتاب الله تعالى من ذكر «إلا» | باب ذكر الألفات اللاتي يكن في أوائل الأفعال | باب ذكر الألفات اللاتي يكن في أوائل الأسماء | باب ذكر الياءات والواوات والألفات اللاتي يحذفن [علامة] للجزم فلا يجوز إثباتهن في الوقف | باب ذكر الياءات اللاتي يكن في أواخر الأسماء | باب ذكر الياءات والواوات والألفات المحذوفات اللاتي يجوز في العربية إثباتهن | باب ذكر ما يوقف عليه بالتاء والهاء | باب ذكر الحرفين اللذين ضم أحدهما إلى صاحبه فصارا حرفا واحدا، لا يحسن السكوت على أحدهما دون الآخر والحرفين اللذين يحسن الوقف على أحدهما دون الآخر | باب ذكر التنوين وما يبدل منه في الوقف | باب ذكر مذاهب القراء في الوقف | باب ذكر أوائل السور إذا وصلت بأواخر السور التي قبلها وذكر الوقف على أسماء السور | فاتحة الكتاب | السورة التي تذكر فيها البقرة | السورة التي يذكر فيها آل عمران | السورة التي يذكر فيها النساء | السورة التي تذكر فيها المائدة | السورة التي تذكر فيها الأنعام | السورة التي يذكر فيها الأعراف | السورة التي تذكر فيها الأنفال | السورة التي تذكر فيها التوبة | السورة التي يذكر فيها يونس | السورة التي يذكر فيها هود | السورة التي يذكر فيها يوسف | السورة التي يذكر فيها الرعد | السورة التي يذكر فيها إبراهيم | السورة التي يذكر فيها الحجر | السورة التي يذكر فيها النحل | السورة التي يذكر فيها بنو إسرائيل | السورة التي يذكر فيها الكهف | سورة مريم عليها السلام | سورة طه | السورة التي يذكر فيها الأنبياء عليهم السلام | سورة الحج | سورة المؤمنين | سورة النور | السورة التي يذكر فيها الفرقان | سورة الشعراء | سورة النمل | سورة القصص | سورة العنكبوت | سورة الروم | سورة لقمان | سورة السجدة | سورة الأحزاب | سورة سبأ | سورة الملائكة | سورة يس | سورة الصافات | سورة صاد | سورة الزمر | سورة المؤمن | حم السجدة | حم عسق | [سورة] الزخرف | حم الدخان | سورة الجاثية | سورة الأحقاف | سورة محمد صلى الله عليه وسلم | سورة الفتح | سورة الحجرات | سورة ق | سورة الذاريات | سورة والطور | سورة والنجم | سورة القمر | سورة الرحمن «عز وجل» | سورة الواقعة | سورة الحديد | سورة المجادلة | سورة الحشر | سورة الممتحنة | سورة الصف | سورة الجمعة | سورة المنافقين | سورة التغابن | سورة الطلاق | سورة التحريم | سورة الملك | سورة ن | سورة الحاقة | سورة سأل سائل | سورة نوح «عليه السلام» | سورة الجن | سورة المزمل | سورة المدثر | سورة القيامة | سورة الإنسان | سورة المرسلات | سورة عم يستاءلون | سورة النازعات | سورة عبس | سورة إذا الشمس كورت | سورة إذا السماء انفطرت | سورة المطففين | سورة إذا السماء انشقت | سورة البروج | سورة الطارق | سورة الغاشية | سورة الفجر | سورة البلد | سورة والشمس وضحاها | سورة والليل | سورة والضحى | [سورة] ألم نشرح | سورة التين | سورة العلق | سورة القدر | سورة لم يكن | سورة إذا زلزلت | سورة العاديات | سورة القارعة | سورة التكاثر | سورة العصر | سورة الهمزة | سورة الفيل | سورة لإيلاف | سورة أرأيت | [سورة] الكوثر | سورة قل يا أيها الكافرون | سورة النصر | [سورة] تبت,https://shamela.ws/book/14255,shamela_output/التجويد_والقراءات/إيضاح_الوقف_والابتداء.txt,,,,فريق رابطة النساخ، والنسخ من إنجازات (معهد آفاق التيسير),,,إيضاح الوقف والابتداء,محيي الدين عبد الرحمن رمضان,,,,,[ابن الأنباري],١٣٩٠هـ - ١٩٧١م,٢ (متسلسلة الترقيم),,,
التجويد والقراءات,السبعة في القراءات,5530,أحمد بن موسى بن العباس التميمي، أبو بكر بن مجاهد البغدادي (ت ٣٢٤هـ),دار المعارف - مصر,الثانية، ١٤٠٠هـ,٧٠٣,645,complete,11-06-2026 18:55:27 IST,كتاب السبعة | بسم الله الرحمن الرحيم | أئمة القراء وأنسابهم وأساتذتهم وتلاميذهم | المدينة | أساتذة نافع | عبد الرحمن بن هرمز الأعرج | تلامذة نافع | مكة | عبد الله بن كثير | تلامذة ابن كثير | الكوفة | أبو بكر عاصم بن أبي النجود | حمزة بن حبيب الزيات | أساتذة حمزة | تلامذة حمزة | علي بن حمزة الكسائي | البصرة | أبو عمرو بن العلاء | أساتذته | تلاميذه | الشام | عبد الله بن عامر اليحصبي | ذكر الأسانيد | التي نقلت إلينا القراءة عن أئمة أهل كل مصر من هذه الأمصار | أسانيد قراءة نافع | أسانيد قراءة ابن كثير | أسانيد قراءة عاصم | أسانيد قراءة حمزة | أسانيد قراءة الكسائي | أسانيد قراءة أبي عمرو بن العلاء | أسانيد قراءة عبد الله بن عامر | سورة فاتحة الكتاب | بسم الله الرحمن الرحيم | الاختلاف في صلة ميم الجمع بواو وفي ضم ضمير الهاء قبلها وكسره | ذكر الإدغام واختلافهم فيه | مذهب نافع | مذهب ابن كثير | مذهب عاصم | مذهب أبي عمرو | مذهب حمزة | مذهب الكسائي | مذهب ابن عامر | إدغام المتماثلين | النون الساكنة والتنوين | سورة البقرة | القراءة في سورة البقرة ومعرفة اختلافهم | المد والقصر | ياءات الإضافة المكسور ما قبلها | سورة آل عمران | القراءة في سورة آل عمران ومعرفة اختلافهم | الهاء المتصلة بالفعل المجزوم | سورة النساء | ذكر اختلافهم في سورة النساء | سورة المائدة | ذكر ما اختلفوا فيه من سورة المائدة | ياءات الإضافة | سورة الأنعام | ذكر ما اختلفوا فيه من سورة الأنعام | ياءات الإضافة والزوائد | سورة الأعراف | ذكر ما اختلفوا فيه من القراءة فى سورة الأعراف | اجتماع استفهامين | ياءات الإضافة | سورة الأنفال | ذكر ما اختلفوا فيه من القراءة فى سورة الأنفال | ياءات الإضافة | سورة التوبة | ياءات الإضافة | سورة يونس | ياءات الإضافة | سورة هود | ياءات الإضافة | سورة يوسف | ياءات الإضافة | سورة الرعد | الوقف على الأسماء المنقوصة | ياءات الإضافة | سورة إبراهيم | ياءات الإضافة | سورة الحجر | ياءات الإضافة | سورة النحل | ياءات الإضافة | سورة الإسراء | ياءات الإضافة | سورة الكهف | ذكر اختلافهم فى سورة الكهف | ياءات الإضافة | سورة مريم | ياءات الإضافة | سورة طه | ياءات الإضافة | سورة الأنبياء | سورة الحج | ياءات الإضافة | سورة المؤمنون | سورة النور | سورة الفرقان | سورة الشعراء | سورة سليمان النمل | سورة القصص | سورة العنكبوت | سورة الروم | سورة لقمان | سورة السجدة | سورة الأحزاب | سورة سبأ | سورة الملائكة فاطر | سورة يس | سورة الصافات | سورة ص | سورة الزمر | سورة المؤمن غافر | سورة فصلت | سورة الشورى عسق | سورة الزخرف | من سورة الدخان إلى سورة الطور | ذكر اختلافهم فى سورة محمد صلى الله عليه وسلم | ذكر اختلافهم فى سورة الفتح | ذكر اختلافهم فى سورة الحجرات | ذكر اختلافهم فى سورة ق | من سورة الطور إلى سورة الحشر | ذكر اختلافهم في سورة الواقعة | من سورة الحشر إلى سورة الملك | من سورة الملك إلى سورة الجن | من سورة الجن إلى سورة النبأ عم يتساءلون | من سورة عم يتساءلون النبأ إلى سورة الأعلى | من سورة الأعلى إلى سورة العلق | من سورة العلق إلى آخر القرآن,https://shamela.ws/book/5530,shamela_output/التجويد_والقراءات/السبعة_في_القراءات.txt,,,,,,,كتاب السبعة في القراءات,شوقي ضيف,,,,,[ابن مجاهد],,,,,
التجويد والقراءات,القطع والائتناف,20966,أبو جعفر أحمد بن محمد بن إسماعيل النَّحَّاس,دار عالم الكتب - المملكة العربية السعودية,الأولى، ١٤١٣ هـ - ١٩٩٢ م,٨٢٩,199,partial,11-06-2026 19:24:18 IST,[+] | مقدمة الكتاب | باب ذكر أشياء من فضائل القرآن وفضائل أهله | باب ذكر صفة قراءة النبي صلى الله عليه وسلم وتبيينه إياها وإنكاره الوقف على غير تمام وذكر تعلم أصحابه القرآن كيف كان | باب ذكر من تعلم من الصحابة والتابعين في القطع والائتناف | باب ما يحتاج إليه من حقق النظر في التمام | باب ذكر الأسانيد لما في هذا الكتاب | [+] | باب ذكر السور | سورة البقرة | سورة آل عمران | سورة النساء | سورة المائدة | سورة الأنعام | سورة الأعراف | سورة الأنفال | سورة التوبة | سورة يونس عليه السلام | سورة هود عليه السلام | سورة يوسف عليه السلام | سورة الرعد | سورة إبراهيم صلى الله عليه وسلم | سورة الحجر | سورة النحل | سورة بني إسرائيل | سورة الكهف | سورة مريم | سورة طه | سورة الأنبياء | سورة الحج | سورة المؤمنون | سورة النور | سورة الفرقان | سورة الشعراء | سورة النمل | سورة القصص | سورة العنكبوت | سورة الروم | سورة لقمان | سورة السجدة | سورة الأحزاب | سورة سبأ | سورة فاطر | سورة يس | سورة الصافات | سورة ص | سورة الزمر | سورة الطول | سورة حم السجدة | سورة حم عسق | سورة الزخرف | سورة الدخان | سورة الشريعة | سورة الأحقاف | سورة محمد صلى الله عليه وسلم | سورة الفتح | سورة الحجرات | سورة ق | سورة والذاريات | سورة الطور | سورة النجم | سورة القمر | سورة الرحمن جل وعز | سورة الواقعة | سورة الحديد | سورة المجادلة | سورة الحشر | سورة الممتحنة | سورة الصف | سورة الجمعة | سورة المنافقين | سورة التغابن | سورة الطلاق | سورة التحريم | سورة الملك | سورة القلم | سورة الحاقة | سورة سأل | سورة نوح عليه السلام | سورة الجن | سورة المزمل | سورة المدثر | سورة القيامة | سورة الإنسان | سورة والمرسلات | سورة النبأ | سورة والنازعات | سورة عبس | سورة التكوير | سورة انفطرت | سورة المطففين | سورة الانشقاق | سورة البروج | سورة الطارق | سورة الأعلى | سورة الغاشية | سورة والفجر | سورة البلد | سورة والشمس | سورة والليل | سورة والضحى | سورة ألم نشرح | سورة والتين | سورة القلم | سورة القدر | سورة البينة | سورة الزلزلة | سورة والعاديات | سورة القارعة | سورة التكاثر | سورة والعصر | سورة الهمزة | سورة الفيل | سورة قريش | سورة الدين | سورة الكوثر | سورة الكافرون | سورة النصر | سورة تبت | ذوات قل [الإخلاص، الفلق، الناس],https://shamela.ws/book/20966,shamela_output/التجويد_والقراءات/القطع_والائتناف.txt,,,,فريق رابطة النساخ برعاية (مركز النخب العلمية),,,القطع والائتناف,د. عبد الرحمن بن إبراهيم المطرودي,,,,,[أبو جعفر النحاس],,,,,
التجويد_والقراءات,المبسوط في القراءات العشر,36104,,,,,74,partial,11-06-2026 19:30:36 IST,,https://shamela.ws/book/36104,shamela_output/التجويد_والقراءات/المبسوط_في_القراءات_العشر.txt,,,,,,,,,,,,,,,,,,
التجويد والقراءات,المصاحف لابن أبي داود,13067,,,,,559,partial,11-06-2026 18:42:32 IST,,https://shamela.ws/book/13067,shamela_output/التجويد_والقراءات/المصاحف_لابن_أبي_داود.txt,,,,,,,,,,,,,,,,,,
التجويد والقراءات,الوقف والابتداء في كتاب الله عز وجل,17843,أَبُو جَعْفَر مُحَمَّد بن سَعْدَان الكوفي النّحويّ المقرئ الضَّرِير (ت ٢٣١ هـ),مركز جمعة الماجد للثقافة والتراث - دبي,الأولى، ١٤٢٣ هـ - ٢٠٠٢ م.,١٨٢,97,complete,11-06-2026 18:40:09 IST,باب (لا) | باب (لا) في النهي | باب (لا) مع الأسماء (المخفوضة) | باب (لا) مع حروف الجزاء | باب (لا) مع حروف الج | باب (إن) مع (ما) | باب تسمية حروف الجزاء,https://shamela.ws/book/17843,shamela_output/التجويد_والقراءات/الوقف_والابتداء_في_كتاب_الله_عز_وجل.txt,,,,فريق رابطة النساخ برعاية (مركز النخب العلمية),,,الوقف والابتداء في كتاب الله عز وجل,أبو بشر محمد خليل الزروق,,,,,[محمد بن سعدان الضرير],,,,,
