category,book,book_id,author,publisher,edition,total_pages,pages_scraped,status,scraped_at,topics,url,file,*تنويه هام,book_index,cat_index,أعده للشاملة,أعده للمكتبة الشاملة,البحث في,الرابط,الكتاب,المترجم,النص,بحث في محتوى الكتب,ترجمة,تصدير,تقديم,تنبيه,تنبيهات هامة,عام النشر,لخصها ونقلها إلى اللغة العربية,لدعم المشروع*,نبذة عن المشروع,نتائج البحث,وصوّر «مجموع الرسائل»
كتب عامة,إجابة الغوث ببيان حال النقباء والنجباء والأبدال والأوتاد والغوث - ط إسطنبول,1636,[,در سعادت، إسطنبول، ١٣٢٥ هـ - ١٩٠٧ م,,١٩,19,complete,11-06-2026 19:25:15 IST,تصفح الكتاب,https://shamela.ws/book/1636,shamela_output/كتب_عامة/إجابة_الغوث_ببيان_حال_النقباء_والنجباء_والأبدال_والأوتاد_والغوث_-_ط_إسطنبول.txt,جميع المساهمات توجه للمصاريف التشغيلية من صف وتدقيق للكتب ونحو ذلك.,,,,,,,إجابة الغوث ببيان حال النقباء والنجباء والأبدال والأوتاد والغوث,,,,,,,,,,,,,,عالم الكتب، وعدة دور نشر أخرى
كتب عامة,الإبداع في مضار الابتداع,701,[,دار الاعتصام,الخامسة، ١٣٧٥ هـ - ١٩٥٦ م,٤٥٣,412,partial,11-06-2026 19:49:50 IST,"[خطبة الكتاب] | [+] | مقدمة الطبعة الخامسة | [+] | ترجمة المؤلف | نشاطه | وضع أساس فن الوعظ والخطابة | الوعظ في المساجد والمجامع العامة | الوعظ في القرى | محاربة البدع والخرافات | الجمعيات الإسلامية العامة | الجمعيات الخاصة | إلقاء دروس دينية في الإذاعة اللاسلكية | دروس شهر رمضان في الأزهر الشريف | التأليف | خاتمة | [+] | مقدمة الكتاب في أخبار الصادق المصدوق بغربة الدين والحث على التمسك بالكتاب والسنة | الحث على التمسك بالدين وإحياء السنة | [+] | الباب الأول في النظر في البدع من جهة الأصول والقواعد | [+] | الفصل الأول في البدعة ومعناها | طريقة ثانية في معنى البدعة | مقارنة بين معنى البدعة على كل من الطريقتين | السنة ومعناها | (السنة ومعناهما) | [+] | الفصل الثاني في تقسيم السنة إلى فعلية وتركية | وإليك نصوص العلماء في تقسيم السنة إلى فعلية وتركية لتزداد بصيرة | الكلام على حديث: ""من أحدث في أمرنا هذا ما ليس منه فهو رد"" | الدين هو ما شرعه الله تعالى | نوع المعاملات | ويستفاد من الحديث الأول أمور | [+] | الفصل الثالث في أقسام البدعة | [+] | وأما البدعة الإضافية | ١ - صلاة الرغائب | ٢ - التلحين في الأذان | ٣ - قراءة الصمدية مائة ألف مرة | ٤ - التأذين للعيدين أو للكسوف | ٥ - الاستغفار عقب الصلاة | ٦ - الأذان يوم الجمعة داخل المسجد | ٧ - تخصيص يوم لم يخصه الشارع يصوم أو ليلة لم يخصها الشارع بقيام | ٨ - رفع الصوت بالذكر أو القرآن أمام الجنازة | ٩ - ختم الصلاة المعروف | ١٠ - الصلاة والسلام على النبي صلى الله عليه وآله وسلم عقب الأذان | [+] | والسمنية - | الأولى: البدعة الواجبة | الثانية: البدعة المندوبة | الثالثة: البدعة المباحة | الرابعة: البدعة المحرمة | الخامسة: البدعة المكروهة | (وأما قسم التحريم) | (وأما قسم المكروه) | [+] | الفصل الرابع في الفرق بين البدع والمصالح المرسلة | (وهناك فرق آخر) | (الأولى) | (والثانية) | [+] | الفصل الخامس في ذم البدع والتحذير من الابتداع | شرح حديث كل بدعة ضلالة | مثار الخلاف في معنى البدعة شرعا | الفصل السادس في أحكام البدعة | [+] | الفصل السابع في الأمر بالمعروف والنهى عن المنكر وكيف يقوم به المرشد | المنكر وكذا النكر | والمعروف | كيف تقاوم البدع؟ | [+] | الباب الثانى في النظر في البدع من جهة فروعها | الفصل الأول في بيان البدع التى تقع في المساجد | [+] | الفصل الثانى في بدع المقابر والأضرحة وزيارة القبور | المبيت في المقابر | اهتمام النساء بزيارة القبور | الكلام مع الإمام الشاطبى ومناقشته | الذريعة وأقسامها | غرس الأشجار في الحيشان | ستور الأضرحة | عرائض الشكوى وإلقاؤها داخل الأضرحة | بناء المساجد على القبور | [+] | الفصل الثالث في بدع الجنائز والمآتم | ما ينبغى أن يقال عند الموت وما لا ينبغى | النياحة وما ينال الميت منها | [+] | الفصل الرابع في بدع الموالد وأول من أحدثها | الموالد | الفصل الخامس في منكرات الأفراح | [+] | الفصل السادس في بدع الأعياد والمواسم | (العيدان الأول والثانى: الفطر والأضحى) | العيد الثالث يوم الجمعة وما أحدث فيه | [+] | الموسم الرابع يوم عاشوراء | ما يقع من الناس في يوم عاشوراء | المواسم التى نسبوها للشرع وليست منه | (خاتمة) | [+] | الفصل السابع في البدع التى تقع في العبادات | بيان سبب بدعة الوسواس مع بيان بطلانه | [+] | الفصل الثامن في بدع الطرق | بيان ما هو الذكر الشرعى | الشبه التى يتمسك بها الذين يحرفون الذكر وردها | [+] | الفصل التاسع في بدع الاعتقادات | العدوى والطيرة والفأل | الفصل العاشر في بدع الضيافة والولائم | [+] | الفصل الحادي عشر في بدع العاشرة والعادات | لماذا أحجم الشبان عن الزواج الشرعي؟ | الفصل الثاني عشر في خرافات العامة وأوهامهم | خاتمة | [+] | تقاريظ العلماء للكتاب | الشيخ دسوقي العربي المالكي | يوسف الدجوى المالكى | الدينارى الشافعى | محمد العناني المالكي | إبراهيم صقر الميهى الشافعي | محمد رشيد رضا | مؤلفات الفقيد",https://shamela.ws/book/701,shamela_output/كتب_عامة/الإبداع_في_مضار_الابتداع.txt,جميع المساهمات توجه للمصاريف التشغيلية من صف وتدقيق للكتب ونحو ذلك.,,,,,,,الإبداع في مضار الابتداع,,,,,,,,,,,,,,
كتب عامة,العلم الظاهر في نفع النسب الطاهر - ط إسطنبول,1605,[,در سعادت، إسطنبول، ١٣٢٥ هـ - ١٩٠٧ م,,٧,7,complete,11-06-2026 19:25:29 IST,تصفح الكتاب,https://shamela.ws/book/1605,shamela_output/كتب_عامة/العلم_الظاهر_في_نفع_النسب_الطاهر_-_ط_إسطنبول.txt,جميع المساهمات توجه للمصاريف التشغيلية من صف وتدقيق للكتب ونحو ذلك.,,,,,,,العلم الظاهر في نفع النسب الطاهر,,,,,,,,,,,,,,عالم الكتب، وعدة دور نشر أخرى
كتب عامة,العلم يدعو للإيمان,4312,[,مكتبة النهضة المصرية للنشر والطبع، بالاشتراك مع مؤسسة فرانكلين للطباعة والنشر بنيويورك - القاهرة,,٢٠٤,170,complete,11-06-2026 19:55:26 IST,هذا الكتاب | كلمة المترجم | تصدير بقلم فضيلة الأستاذ الشيخ أحمد حسن الباقوري مدير جامعة الازهر | مقدمة بقلم: الدكتور أحمد زكي مدير جامعة القاهرة سابقا | مقدمة المؤلف | الفصل الاول: عالمنا الفذ | الفصل الثاني: الهواء والمحيط | الفصل الثالث: الغازات التي نتنسمها | الفصل الرابع: النتروجين: تنظيم مزدوج | الفصل الخامس: ما هي الحياة | الفصل السادس: كيف بدأت الحياة | الفصل السابع: اصل الانسان | الفصل الثامن: غرائز الحيوانات | الفصل التاسع: تطور العقل | الفصل العاشر: وحدات الوراثة | الفصل الحادي عشر: أعظم معمل في العالم | الفصل الثاني عشر: ضوابط وموازين | الفصل الثالث عشر: الزمن | الفصل الرابع عشر: قوة التصور | الفصل الخامس عشر: استعراض | الفصل السادس عشر: المصادفة | الفصل السابع عشر: خاتمه,https://shamela.ws/book/4312,shamela_output/كتب_عامة/العلم_يدعو_للإيمان.txt,جميع المساهمات توجه للمصاريف التشغيلية من صف وتدقيق للكتب ونحو ذلك.,,,,,,,العلم يدعو للإيمان,محمود صالح الفلكي,,,,الشيخ أحمد حسن الباقوري، مدير جامعة الأزهر,الدكتور أحمد زكي، مدير جامعة القاهرة,أضاف المترجم آيات قرآنية تناسب المقام، مما جعل البعض يظن أن المؤلف (إبراهام كريسي موريسون) مسلم، فليتنبه لهذا,,١٩٥٨ م,,,,,
كتب عامة,الغارة على العالم الإسلامي,96607,[,منشورات العصر الحديث,الثانية، ١٣٨٧ هـ,٢٨٦,278,complete,11-06-2026 19:33:45 IST,"الغارة على العالم الإسلامي | [مقدمة الطبعة الأولى] | توطئة من "" المؤيد "" | مقدمة المسيو شاتليه عن إرساليات التبشير البروتستانتية | [+] | تاريخ التبشير | أفريقيا | آسيا الغربية | الهند | جزائر الملايو | الصين | مؤتمر القاهرة التبشيري عام ١٩٠٦ م | وسائل لتبشير المسلمين بالنصرانية | إرساليات التبشير الطبية | الأعمال النسائية في التبشير | المتنصرون والمرتدون | شروط التعميد | كيف يتقرب المسلمون؟ | موضوعات تبشيرية | العالم الإسلامي اليوم | الإسلام في مصر | الإسلام وإرساليات الهند | بلاد الترك العثمانية | سوريا وفلسطين | الجزيرة العربية | فارس | صومطرا | جاوا | مؤتمر إدنبرج سنة ١٩١٠ | أقوال المجلة الألمانية | أقوال المجلة الإنكليزية | أقوال المجلة السويسرية | نتائج مؤتمر إدنبرج | المؤتمر الاستعماري | [+] | مؤتمر لكنو سنة ١٩١١ | مقدمة المجلة الفرنسية | برنامج المؤتمر وترتيبه | خطبة الرئيس الافتتاحية | الاحصاءات الإسلامية | الانقلابات السياسية | الانقلابات الاجتماعية والفكرية | خطة الكنائس بعد مؤتمر القاهرة | أعمال اللجان بعد مؤتمر القاهرة | الجامعة الإسلامية | الانقلابات السياسية | الجلسة النهائية | التنظيم المادي لإرساليات التبشير | مقاصد المبشرين وآمالهم في المستقبل | ملحق | نجوى إلى القراء | جواب "" المؤيد "" على مقالة مجلة "" العالم الإسلامي "" | كلمة في هذا الكتاب",https://shamela.ws/book/96607,shamela_output/كتب_عامة/الغارة_على_العالم_الإسلامي.txt,جميع المساهمات توجه للمصاريف التشغيلية من صف وتدقيق للكتب ونحو ذلك.,,,,توفيق بن محمد القريشي,,,الغارة على العالم الإسلامي,,,,,,,,,,مُساعد اليافي، مُحبُّ الدين الخطيب,,,,
