category,book,book_id,author,publisher,edition,total_pages,pages_scraped,status,scraped_at,topics,url,file,*تنويه هام,book_index,cat_index,أعده للمكتبة الشاملة,البحث في,الرابط,الكتاب,النص,بحث في محتوى الكتب,تنبيهات هامة,لخصها ونقلها إلى اللغة العربية,لدعم المشروع*,نبذة عن المشروع,نتائج البحث,وصوّر «مجموع الرسائل»
كتب عامة,إجابة الغوث ببيان حال النقباء والنجباء والأبدال والأوتاد والغوث - ط إسطنبول,1636,[,در سعادت، إسطنبول، ١٣٢٥ هـ - ١٩٠٧ م,,١٩,19,complete,11-06-2026 19:25:15 IST,تصفح الكتاب,https://shamela.ws/book/1636,shamela_output/كتب_عامة/إجابة_الغوث_ببيان_حال_النقباء_والنجباء_والأبدال_والأوتاد_والغوث_-_ط_إسطنبول.txt,جميع المساهمات توجه للمصاريف التشغيلية من صف وتدقيق للكتب ونحو ذلك.,,,,,,إجابة الغوث ببيان حال النقباء والنجباء والأبدال والأوتاد والغوث,,,,,,,,عالم الكتب، وعدة دور نشر أخرى
كتب عامة,العلم الظاهر في نفع النسب الطاهر - ط إسطنبول,1605,[,در سعادت، إسطنبول، ١٣٢٥ هـ - ١٩٠٧ م,,٧,7,complete,11-06-2026 19:25:29 IST,تصفح الكتاب,https://shamela.ws/book/1605,shamela_output/كتب_عامة/العلم_الظاهر_في_نفع_النسب_الطاهر_-_ط_إسطنبول.txt,جميع المساهمات توجه للمصاريف التشغيلية من صف وتدقيق للكتب ونحو ذلك.,,,,,,العلم الظاهر في نفع النسب الطاهر,,,,,,,,عالم الكتب، وعدة دور نشر أخرى
كتب عامة,الغارة على العالم الإسلامي,96607,[,منشورات العصر الحديث,الثانية، ١٣٨٧ هـ,٢٨٦,278,complete,11-06-2026 19:33:45 IST,"الغارة على العالم الإسلامي | [مقدمة الطبعة الأولى] | توطئة من "" المؤيد "" | مقدمة المسيو شاتليه عن إرساليات التبشير البروتستانتية | [+] | تاريخ التبشير | أفريقيا | آسيا الغربية | الهند | جزائر الملايو | الصين | مؤتمر القاهرة التبشيري عام ١٩٠٦ م | وسائل لتبشير المسلمين بالنصرانية | إرساليات التبشير الطبية | الأعمال النسائية في التبشير | المتنصرون والمرتدون | شروط التعميد | كيف يتقرب المسلمون؟ | موضوعات تبشيرية | العالم الإسلامي اليوم | الإسلام في مصر | الإسلام وإرساليات الهند | بلاد الترك العثمانية | سوريا وفلسطين | الجزيرة العربية | فارس | صومطرا | جاوا | مؤتمر إدنبرج سنة ١٩١٠ | أقوال المجلة الألمانية | أقوال المجلة الإنكليزية | أقوال المجلة السويسرية | نتائج مؤتمر إدنبرج | المؤتمر الاستعماري | [+] | مؤتمر لكنو سنة ١٩١١ | مقدمة المجلة الفرنسية | برنامج المؤتمر وترتيبه | خطبة الرئيس الافتتاحية | الاحصاءات الإسلامية | الانقلابات السياسية | الانقلابات الاجتماعية والفكرية | خطة الكنائس بعد مؤتمر القاهرة | أعمال اللجان بعد مؤتمر القاهرة | الجامعة الإسلامية | الانقلابات السياسية | الجلسة النهائية | التنظيم المادي لإرساليات التبشير | مقاصد المبشرين وآمالهم في المستقبل | ملحق | نجوى إلى القراء | جواب "" المؤيد "" على مقالة مجلة "" العالم الإسلامي "" | كلمة في هذا الكتاب",https://shamela.ws/book/96607,shamela_output/كتب_عامة/الغارة_على_العالم_الإسلامي.txt,جميع المساهمات توجه للمصاريف التشغيلية من صف وتدقيق للكتب ونحو ذلك.,,,توفيق بن محمد القريشي,,,الغارة على العالم الإسلامي,,,,مُساعد اليافي، مُحبُّ الدين الخطيب,,,,
كتب عامة,سل الحسام الهندي لنصرة مولانا خالد النقشبندي - ط إسطنبول,1637,[,در سعادت، إسطنبول، ١٣٢٥ هـ - ١٩٠٧ م,,٤٧,47,complete,11-06-2026 19:26:32 IST,تصفح الكتاب,https://shamela.ws/book/1637,shamela_output/كتب_عامة/سل_الحسام_الهندي_لنصرة_مولانا_خالد_النقشبندي_-_ط_إسطنبول.txt,جميع المساهمات توجه للمصاريف التشغيلية من صف وتدقيق للكتب ونحو ذلك.,,,,,,سل الحسام الهندي لنصرة مولانا خالد النقشبندي,,,,,,,,عالم الكتب، وعدة دور نشر أخرى
كتب عامة,مناهل السرور لمبتغى الحساب بالكسور - ط إسطنبول,1634,[,در سعادت، إسطنبول، ١٣٢٥ هـ - ١٩٠٧ م,,٦,6,complete,11-06-2026 19:26:55 IST,تصفح الكتاب,https://shamela.ws/book/1634,shamela_output/كتب_عامة/مناهل_السرور_لمبتغى_الحساب_بالكسور_-_ط_إسطنبول.txt,جميع المساهمات توجه للمصاريف التشغيلية من صف وتدقيق للكتب ونحو ذلك.,,,,,,مناهل السرور لمبتغى الحساب بالكسور,,,,,,,,عالم الكتب، وعدة دور نشر أخرى
